{
  "evidence": [],
  "gitCommit": "f5a2453e92eaed0e53801c23514c79c1bb8492e4",
  "message": "Targeted Maven tests are configured; full mode is required for execution",
  "metrics": {},
  "mode": "preflight",
  "phase": "69F",
  "schemaVersion": 1,
  "status": "PREPARED",
  "timestamp": "2026-06-23T13:32:22.121656+00:00"
}
